# name: test/sql/local/catalog_test_config_setup/catalog_agnostic/insert/count_star_optimizer.test
# description: Test count star optimizer in an iceberg scan
# group: [insert]

statement ok
SET profiling_renderer_settings = MAP {'operator_casing': 'upper'};

require-env CATALOG_TEST_CONFIG_SETUP

require avro

require parquet

require iceberg

require httpfs

# Do not ignore 'HTTP' error messages!
set ignore_error_messages

statement ok
set enable_logging=true

statement ok
set logging_level='debug'

# use statistics information.
query II
explain SELECT count(*) FROM my_datalake.default.count_star_optimizer;
----
physical_plan	<REGEX>:.*COLUMN_DATA_SCAN.*~1.*


statement ok
BEGIN;

query I
select count(*) from my_datalake.default.count_star_optimizer;
----
2

statement ok
insert into my_datalake.default.count_star_optimizer select 3,'ccc';

query I
select count(*) from my_datalake.default.count_star_optimizer;
----
3

statement ok
ABORT;

# Insert two rows as a single data file, then delete one of them. Deleting a strict subset of a
# file's rows is always a merge-on-read (positional) delete regardless of how the catalog laid out
# the pre-existing rows, so this exercises the "delete file present" path deterministically (a
# whole-file delete would instead be metadata-only and leave no delete file).
statement ok
insert into my_datalake.default.count_star_optimizer values (10, 'j'), (11, 'k');

statement ok
delete from my_datalake.default.count_star_optimizer where id = 10;

query I
select count(*) from my_datalake.default.count_star_optimizer;
----
3

# a positional delete file is present, so the count(*) optimizer cannot use the metadata row count.
query II
explain SELECT count(*) FROM  my_datalake.default.count_star_optimizer;
----
physical_plan	<REGEX>:.*ICEBERG_SCAN.*row.*



