# name: test/sql/local/catalog_test_config_setup/catalog_agnostic/reads/filtering/late_materialization_topn_v2.test
# description: Iceberg V2 TopN late materialization
# group: [filtering]

require-env CATALOG_TEST_CONFIG_SETUP

require avro

require parquet

require iceberg

require httpfs

# Do not ignore 'HTTP' error messages!
set ignore_error_messages

statement ok
CREATE SCHEMA IF NOT EXISTS my_datalake.default;

statement ok
DROP VIEW IF EXISTS late_materialization_topn;

statement ok
DROP TABLE IF EXISTS my_datalake.default.late_materialization_topn_v2;

statement ok
SET threads = 1;

statement ok
CREATE TABLE my_datalake.default.late_materialization_topn_v2 (
	record_id BIGINT,
	sort_key BIGINT,
	filter_key VARCHAR,
	payload_a VARCHAR,
	payload_b VARCHAR,
	payload_c VARCHAR
) WITH ('format-version' = 2);

# Each INSERT creates one data file, so equal offsets have overlapping
# file_row_number values. Position 6 is filtered out, and the fifth TopN row
# comes from only one file at position 7. Joining on file_row_number alone
# would therefore return an extra row.
statement ok
INSERT INTO my_datalake.default.late_materialization_topn_v2
SELECT
	2 * i AS record_id,
	CASE WHEN i < 2 THEN 100 - i ELSE NULL END AS sort_key,
	CASE WHEN i = 6 THEN 'excluded' ELSE 'selected' END AS filter_key,
	concat(repeat('a', 256), '_', CAST(2 * i AS VARCHAR)) AS payload_a,
	concat(repeat('b', 256), '_', CAST(2 * i AS VARCHAR)) AS payload_b,
	concat(repeat('c', 256), '_', CAST(2 * i AS VARCHAR)) AS payload_c
FROM range(8) t(i);

statement ok
INSERT INTO my_datalake.default.late_materialization_topn_v2
SELECT
	2 * i + 1 AS record_id,
	CASE WHEN i < 2 THEN 100 - i ELSE NULL END AS sort_key,
	CASE WHEN i = 6 THEN 'excluded' ELSE 'selected' END AS filter_key,
	concat(repeat('a', 256), '_', CAST(2 * i + 1 AS VARCHAR)) AS payload_a,
	concat(repeat('b', 256), '_', CAST(2 * i + 1 AS VARCHAR)) AS payload_b,
	concat(repeat('c', 256), '_', CAST(2 * i + 1 AS VARCHAR)) AS payload_c
FROM range(8) t(i);

query I
SELECT count(*)
FROM iceberg_metadata(my_datalake.default.late_materialization_topn_v2)
WHERE manifest_content = 'DATA';
----
2

statement ok
SET threads = 4;

statement ok
CREATE VIEW late_materialization_topn AS
SELECT
	record_id,
	sort_key,
	payload_a,
	payload_b,
	payload_c
FROM my_datalake.default.late_materialization_topn_v2
WHERE filter_key = 'selected'
ORDER BY sort_key DESC NULLS LAST, record_id DESC
LIMIT 5;

statement ok
SET late_materialization_max_rows = 5;

# The optimized scan must return the same ordered rows and payload as the
# original plan.
statement ok
SET disabled_optimizers = 'late_materialization';

query IITTT nosort late_materialization_result
SELECT * FROM late_materialization_topn;

statement ok
SET disabled_optimizers = '';

query IITTT nosort late_materialization_result
SELECT * FROM late_materialization_topn;

statement ok
SET explain_output = 'optimized_only';

query II
EXPLAIN (FORMAT JSON) SELECT * FROM late_materialization_topn;
----
logical_opt	<REGEX>:(?s).*ORDER_BY.*COMPARISON_JOIN.*ICEBERG_SCAN.*TOP_N.*ICEBERG_SCAN.*filename.*file_row_number.*

# Iceberg only opts in when DuckDB can lower the ORDER BY ... LIMIT shape to
# its TopN path; LIMIT without ORDER BY, SAMPLE, and window paths remain
# unchanged.
query II
EXPLAIN (FORMAT JSON) SELECT payload_a
FROM my_datalake.default.late_materialization_topn_v2
LIMIT 5 OFFSET 1;
----
logical_opt	<!REGEX>:(?s).*COMPARISON_JOIN.*

query II
EXPLAIN (FORMAT JSON) SELECT payload_a
FROM my_datalake.default.late_materialization_topn_v2
USING SAMPLE 5 ROWS;
----
logical_opt	<!REGEX>:(?s).*COMPARISON_JOIN.*

query II
EXPLAIN (FORMAT JSON) SELECT
	record_id,
	payload_a,
	row_number() OVER (ORDER BY record_id DESC) AS row_number
FROM my_datalake.default.late_materialization_topn_v2
QUALIFY row_number <= 5;
----
logical_opt	<!REGEX>:(?s).*COMPARISON_JOIN.*

query II
EXPLAIN (FORMAT JSON) SELECT record_id, payload_a
FROM my_datalake.default.late_materialization_topn_v2
ORDER BY sort_key DESC NULLS LAST, record_id DESC
LIMIT 6;
----
logical_opt	<!REGEX>:(?s).*COMPARISON_JOIN.*

# Create position-delete files for the same physical position in both data
# files. Late materialization remains enabled, and both scans must apply both
# delete files.
statement ok
DELETE FROM my_datalake.default.late_materialization_topn_v2
WHERE record_id = 15;

statement ok
DELETE FROM my_datalake.default.late_materialization_topn_v2
WHERE record_id = 14;

query I
SELECT count(*)
FROM iceberg_metadata(my_datalake.default.late_materialization_topn_v2)
WHERE manifest_content = 'DELETE';
----
2

statement ok
SET disabled_optimizers = 'late_materialization';

query IITTT nosort late_materialization_delete_result
SELECT * FROM late_materialization_topn;

statement ok
SET disabled_optimizers = '';

query IITTT nosort late_materialization_delete_result
SELECT * FROM late_materialization_topn;

query II
EXPLAIN (FORMAT JSON) SELECT * FROM late_materialization_topn;
----
logical_opt	<REGEX>:(?s).*ORDER_BY.*COMPARISON_JOIN.*ICEBERG_SCAN.*TOP_N.*ICEBERG_SCAN.*filename.*file_row_number.*

# Data-only write plans can use TopN late materialization in their source scans.
statement ok
CREATE TEMP TABLE late_materialization_insert_target (
	record_id BIGINT,
	sort_key BIGINT,
	filter_key VARCHAR,
	payload_a VARCHAR,
	payload_b VARCHAR,
	payload_c VARCHAR
);

query II
EXPLAIN (FORMAT JSON)
INSERT INTO late_materialization_insert_target
SELECT record_id, sort_key, filter_key, payload_a, payload_b, payload_c
FROM my_datalake.default.late_materialization_topn_v2
WHERE filter_key = 'selected'
ORDER BY sort_key DESC NULLS LAST, record_id DESC
LIMIT 2;
----
logical_opt	<REGEX>:(?s).*COMPARISON_JOIN.*TOP_N.*

statement ok
SET disabled_optimizers = 'late_materialization';

query IITTTT nosort late_materialization_insert_result
INSERT INTO late_materialization_insert_target
SELECT * FROM my_datalake.default.late_materialization_topn_v2
WHERE filter_key = 'selected'
ORDER BY sort_key DESC NULLS LAST, record_id DESC LIMIT 2
RETURNING *;

statement ok
DELETE FROM late_materialization_insert_target;

statement ok
SET disabled_optimizers = '';

query IITTTT nosort late_materialization_insert_result
INSERT INTO late_materialization_insert_target
SELECT * FROM my_datalake.default.late_materialization_topn_v2
WHERE filter_key = 'selected'
ORDER BY sort_key DESC NULLS LAST, record_id DESC LIMIT 2
RETURNING *;

statement ok
DROP TABLE late_materialization_insert_target;

# Materialized CTE producers feeding INSERT use the same admission policy.
statement ok
CREATE TEMP TABLE late_materialization_cte_insert_target (
	record_id BIGINT,
	sort_key BIGINT,
	filter_key VARCHAR,
	payload_a VARCHAR,
	payload_b VARCHAR,
	payload_c VARCHAR
);

query II
EXPLAIN (FORMAT JSON)
WITH source AS MATERIALIZED (
	SELECT record_id, sort_key, filter_key, payload_a, payload_b, payload_c
	FROM my_datalake.default.late_materialization_topn_v2
	WHERE filter_key = 'selected'
	ORDER BY sort_key DESC NULLS LAST, record_id DESC
	LIMIT 2
)
INSERT INTO late_materialization_cte_insert_target
SELECT * FROM source;
----
logical_opt	<REGEX>:(?s).*COMPARISON_JOIN.*TOP_N.*

query IITTTT nosort late_materialization_insert_result
WITH source AS MATERIALIZED (
    SELECT * FROM my_datalake.default.late_materialization_topn_v2
    WHERE filter_key = 'selected'
    ORDER BY sort_key DESC NULLS LAST, record_id DESC LIMIT 2
)
INSERT INTO late_materialization_cte_insert_target SELECT * FROM source
RETURNING *;

statement ok
DROP TABLE late_materialization_cte_insert_target;

# A prepared Iceberg query must be rebound when transaction-local metadata changes.
statement ok
PREPARE late_materialization_rebind AS
SELECT record_id, payload_a
FROM my_datalake.default.late_materialization_topn_v2
WHERE filter_key = 'selected'
ORDER BY sort_key DESC NULLS LAST, record_id DESC
LIMIT 5;

query II
EXPLAIN (FORMAT JSON) EXECUTE late_materialization_rebind;
----
logical_opt	<REGEX>:(?s).*COMPARISON_JOIN.*TOP_N.*

statement ok
BEGIN;

statement ok
ALTER TABLE my_datalake.default.late_materialization_topn_v2 ADD COLUMN prepared_rebind_column VARCHAR;

query II
EXPLAIN (FORMAT JSON) EXECUTE late_materialization_rebind;
----
logical_opt	<REGEX>:(?s).*COMPARISON_JOIN.*TOP_N.*

statement ok
ROLLBACK;

query II
EXPLAIN (FORMAT JSON) EXECUTE late_materialization_rebind;
----
logical_opt	<REGEX>:(?s).*COMPARISON_JOIN.*TOP_N.*

statement ok
DEALLOCATE late_materialization_rebind;

# A plan bound before a data change must also be rebound. This covers the case
# where transaction_data is created after the original late-materialization
# decision, without relying on a schema change to invalidate the statement.
statement ok
PREPARE late_materialization_data_rebind AS
SELECT record_id, sort_key, length(payload_a) AS payload_length
FROM my_datalake.default.late_materialization_topn_v2
WHERE filter_key = 'selected'
ORDER BY sort_key DESC NULLS LAST, record_id DESC
LIMIT 1;

query II
EXPLAIN (FORMAT JSON) EXECUTE late_materialization_data_rebind;
----
logical_opt	<REGEX>:(?s).*COMPARISON_JOIN.*TOP_N.*

statement ok
BEGIN;

statement ok
INSERT INTO my_datalake.default.late_materialization_topn_v2
VALUES (100, 101, 'selected', 'prepared_insert_a', 'prepared_insert_b', 'prepared_insert_c');

query II
EXPLAIN (FORMAT JSON) EXECUTE late_materialization_data_rebind;
----
logical_opt	<REGEX>:(?s).*COMPARISON_JOIN.*TOP_N.*

query III
EXECUTE late_materialization_data_rebind;
----
100	101	17

statement ok
ROLLBACK;

query II
EXPLAIN (FORMAT JSON) EXECUTE late_materialization_data_rebind;
----
logical_opt	<REGEX>:(?s).*COMPARISON_JOIN.*TOP_N.*

statement ok
DEALLOCATE late_materialization_data_rebind;

# A read-only transaction has a fixed snapshot and remains eligible.
statement ok
BEGIN;

query II
EXPLAIN (FORMAT JSON) SELECT * FROM late_materialization_topn;
----
logical_opt	<REGEX>:(?s).*ORDER_BY.*COMPARISON_JOIN.*ICEBERG_SCAN.*TOP_N.*ICEBERG_SCAN.*

statement ok
ROLLBACK;

# Both independent scans include the transaction-local delete manifests.
statement ok
BEGIN;

statement ok
DELETE FROM my_datalake.default.late_materialization_topn_v2
WHERE record_id = 11;

statement ok
SET disabled_optimizers = 'late_materialization';

query IITTT nosort late_materialization_transaction_delete_result
SELECT * FROM late_materialization_topn;

statement ok
SET disabled_optimizers = '';

query IITTT nosort late_materialization_transaction_delete_result
SELECT * FROM late_materialization_topn;

query II
EXPLAIN (FORMAT JSON) SELECT * FROM late_materialization_topn;
----
logical_opt	<REGEX>:(?s).*COMPARISON_JOIN.*TOP_N.*

statement ok
ROLLBACK;

# Both independent scans include transaction-local data manifests from appends.
statement ok
BEGIN;

statement ok
INSERT INTO my_datalake.default.late_materialization_topn_v2
VALUES (100, 101, 'selected', 'insert_a', 'insert_b', 'insert_c');

statement ok
SET disabled_optimizers = 'late_materialization';

query IITTT nosort late_materialization_transaction_insert_result
SELECT * FROM late_materialization_topn;

statement ok
SET disabled_optimizers = '';

query IITTT nosort late_materialization_transaction_insert_result
SELECT * FROM late_materialization_topn;

query II
EXPLAIN (FORMAT JSON) SELECT * FROM late_materialization_topn;
----
logical_opt	<REGEX>:(?s).*COMPARISON_JOIN.*TOP_N.*

statement ok
ROLLBACK;

# UPDATE contributes both data and delete manifests to the two scans.
statement ok
BEGIN;

statement ok
UPDATE my_datalake.default.late_materialization_topn_v2
SET sort_key = 102, payload_a = 'update_a'
WHERE record_id = 10;

statement ok
SET disabled_optimizers = 'late_materialization';

query IITTT nosort late_materialization_transaction_update_result
SELECT * FROM late_materialization_topn;

statement ok
SET disabled_optimizers = '';

query IITTT nosort late_materialization_transaction_update_result
SELECT * FROM late_materialization_topn;

query II
EXPLAIN (FORMAT JSON) SELECT * FROM late_materialization_topn;
----
logical_opt	<REGEX>:(?s).*COMPARISON_JOIN.*TOP_N.*

statement ok
ROLLBACK;

# Repeated reads must initialize fresh manifest state as the transaction grows.
statement ok
BEGIN;

statement ok
INSERT INTO my_datalake.default.late_materialization_topn_v2
VALUES (100, 101, 'selected', 'append', 'b', 'c');

query IIT
SELECT record_id, sort_key, payload_a
FROM my_datalake.default.late_materialization_topn_v2
ORDER BY sort_key DESC NULLS LAST, record_id DESC LIMIT 1;
----
100	101	append

statement ok
DELETE FROM my_datalake.default.late_materialization_topn_v2 WHERE record_id = 1;

statement ok
UPDATE my_datalake.default.late_materialization_topn_v2
SET sort_key = 102, payload_a = 'mixed' WHERE record_id = 0;

query II
EXPLAIN (FORMAT JSON) SELECT * FROM late_materialization_topn;
----
logical_opt	<REGEX>:(?s).*COMPARISON_JOIN.*TOP_N.*

query IIT nosort late_materialization_mixed_result
SELECT record_id, sort_key, payload_a
FROM my_datalake.default.late_materialization_topn_v2
ORDER BY sort_key DESC NULLS LAST, record_id DESC LIMIT 2;
----
0	102	mixed
100	101	append

statement ok
SET disabled_optimizers = 'late_materialization';

query IIT nosort late_materialization_mixed_result
SELECT record_id, sort_key, payload_a
FROM my_datalake.default.late_materialization_topn_v2
ORDER BY sort_key DESC NULLS LAST, record_id DESC LIMIT 2;

statement ok
SET disabled_optimizers = '';

statement ok
ROLLBACK;

statement ok
SET VARIABLE late_materialization_snapshot = (
	SELECT snapshot_id FROM iceberg_snapshots(my_datalake.default.late_materialization_topn_v2)
	ORDER BY sequence_number DESC LIMIT 1
);

# Explicit time travel shares the bound snapshot, with independent scan state.
query II
EXPLAIN (FORMAT JSON) SELECT record_id, payload_a
FROM my_datalake.default.late_materialization_topn_v2
AT (VERSION => getvariable('late_materialization_snapshot'))
ORDER BY sort_key DESC NULLS LAST, record_id DESC LIMIT 2;
----
logical_opt	<REGEX>:(?s).*COMPARISON_JOIN.*TOP_N.*

# Both scans use transaction-visible metadata after DDL. Each rollback restores V2 state.
statement ok
BEGIN;

statement ok
ALTER TABLE my_datalake.default.late_materialization_topn_v2 ADD COLUMN pending_schema_column VARCHAR;

query IITTT nosort late_materialization_delete_result
SELECT * FROM late_materialization_topn;

# Time travel omits pending manifests, but still uses the transaction-local table object.
query II
EXPLAIN (FORMAT JSON) SELECT record_id, payload_a
FROM my_datalake.default.late_materialization_topn_v2
AT (VERSION => getvariable('late_materialization_snapshot'))
ORDER BY sort_key DESC NULLS LAST, record_id DESC LIMIT 2;
----
logical_opt	<REGEX>:(?s).*COMPARISON_JOIN.*TOP_N.*

query II
EXPLAIN (FORMAT JSON) SELECT record_id, pending_schema_column, payload_a
FROM my_datalake.default.late_materialization_topn_v2
ORDER BY sort_key DESC NULLS LAST, record_id DESC
LIMIT 2;
----
logical_opt	<REGEX>:(?s).*COMPARISON_JOIN.*TOP_N.*

statement ok
ROLLBACK;

statement ok
BEGIN;

statement ok
ALTER TABLE my_datalake.default.late_materialization_topn_v2 SET PARTITIONED BY (filter_key);

query IITTT nosort late_materialization_delete_result
SELECT * FROM late_materialization_topn;

query II
EXPLAIN (FORMAT JSON) SELECT record_id, payload_a
FROM my_datalake.default.late_materialization_topn_v2
WHERE filter_key = 'selected'
ORDER BY sort_key DESC NULLS LAST, record_id DESC
LIMIT 2;
----
logical_opt	<REGEX>:(?s).*COMPARISON_JOIN.*TOP_N.*

statement ok
ROLLBACK;

statement ok
BEGIN;

statement ok
ALTER TABLE my_datalake.default.late_materialization_topn_v2 SET ('late-materialization-test' = 'pending');

query IITTT nosort late_materialization_delete_result
SELECT * FROM late_materialization_topn;

query II
EXPLAIN (FORMAT JSON) SELECT record_id, payload_a
FROM my_datalake.default.late_materialization_topn_v2
ORDER BY sort_key DESC NULLS LAST, record_id DESC
LIMIT 2;
----
logical_opt	<REGEX>:(?s).*COMPARISON_JOIN.*TOP_N.*

statement ok
ROLLBACK;

statement ok
BEGIN;

# A format update that stays at V2 keeps late materialization enabled.
statement ok
ALTER TABLE my_datalake.default.late_materialization_topn_v2 SET ('format-version' = 2);

query IITTT nosort late_materialization_delete_result
SELECT * FROM late_materialization_topn;

query II
EXPLAIN (FORMAT JSON) SELECT record_id, payload_a
FROM my_datalake.default.late_materialization_topn_v2
ORDER BY sort_key DESC NULLS LAST, record_id DESC
LIMIT 2;
----
logical_opt	<REGEX>:(?s).*COMPARISON_JOIN.*TOP_N.*

statement ok
ROLLBACK;

query II
EXPLAIN (FORMAT JSON) SELECT * FROM late_materialization_topn;
----
logical_opt	<REGEX>:(?s).*ORDER_BY.*COMPARISON_JOIN.*ICEBERG_SCAN.*TOP_N.*ICEBERG_SCAN.*filename.*file_row_number.*

# Unlike the RDS binder error, the current partition resolver throws an
# InvalidInputException and aborts the transaction. This is independent of LM.
foreach mode on off

onlyif mode==off
statement ok
SET disabled_optimizers = 'late_materialization';

statement ok
BEGIN;

statement error
ALTER TABLE my_datalake.default.late_materialization_topn_v2 SET PARTITIONED BY (missing_partition_column);
----
No column by the name 'missing_partition_column' exists in the current schema

statement error
SELECT * FROM late_materialization_topn;
----
Current transaction is aborted

statement ok
ROLLBACK;

endloop

statement ok
SET disabled_optimizers = '';

query II
EXPLAIN (FORMAT JSON) SELECT * FROM late_materialization_topn;
----
logical_opt	<REGEX>:(?s).*COMPARISON_JOIN.*TOP_N.*

query IITTT nosort late_materialization_delete_result
SELECT * FROM late_materialization_topn;

statement ok
RESET explain_output;

statement ok
RESET late_materialization_max_rows;

statement ok
SET disabled_optimizers = '';

statement ok
RESET threads;

statement ok
DROP VIEW late_materialization_topn;

statement ok
DROP TABLE my_datalake.default.late_materialization_topn_v2;
