# name: test/sql/local/catalog_custom_setup/fixture/no_default_namespace.test
# description: a catalog attached without DEFAULT_SCHEMA has no default namespace - qualified names still work, and an unqualified one says so
# group: [fixture]

require-env FIXTURE_SERVER_AVAILABLE

require avro

require parquet

require iceberg

require httpfs

# Do not ignore 'HTTP' error messages!
set ignore_error_messages

statement ok
CREATE SECRET storage_secret(
	TYPE S3,
	KEY_ID 'admin',
	SECRET 'password',
	ENDPOINT '127.0.0.1:9000',
	URL_STYLE 'path',
	USE_SSL 0
);

statement ok
CREATE SECRET iceberg_secret (
	TYPE ICEBERG,
	CLIENT_ID 'admin',
	CLIENT_SECRET 'password',
	URI 'http://127.0.0.1:8181'
);

statement ok
ATTACH '' AS my_datalake (
	TYPE ICEBERG,
	SECRET iceberg_secret
);

statement ok
CREATE SCHEMA IF NOT EXISTS my_datalake.bronze;

statement ok
DROP TABLE IF EXISTS my_datalake.bronze.T;

# qualified names are unaffected
statement ok
CREATE TABLE my_datalake.bronze.T AS SELECT 42;

query I
SELECT * FROM my_datalake.bronze.T;
----
42

# an unqualified name has no namespace to resolve to, and says which knob to reach for
statement error
CREATE TABLE my_datalake.T2 AS SELECT 43;
----
<REGEX>:.*No default namespace for catalog "my_datalake".*DEFAULT_SCHEMA.*

# the same holds for a table that cannot be resolved: the message names the table and how to qualify it,
# rather than reporting a bare "table does not exist"
statement error
SELECT * FROM my_datalake.T;
----
<REGEX>:.*No default namespace for catalog "my_datalake".*my_datalake.<namespace>.T.*

statement error
INSERT INTO my_datalake.T VALUES (1);
----
<REGEX>:.*No default namespace for catalog "my_datalake".*

statement error
DELETE FROM my_datalake.T;
----
<REGEX>:.*No default namespace for catalog "my_datalake".*

statement error
DROP TABLE my_datalake.T;
----
<REGEX>:.*No default namespace for catalog "my_datalake".*

statement error
DESCRIBE my_datalake.T;
----
<REGEX>:.*No default namespace for catalog "my_datalake".*

# attaching the same catalog with a default namespace resolves the very same unqualified name
statement ok
ATTACH '' AS with_default (
	TYPE ICEBERG,
	SECRET iceberg_secret,
	DEFAULT_SCHEMA 'bronze'
);

query I
SELECT * FROM with_default.T;
----
42

statement ok
DETACH with_default;

statement ok
DROP TABLE my_datalake.bronze.T;

statement ok
DROP SCHEMA my_datalake.bronze;

statement ok
DETACH my_datalake;

statement ok
DROP SECRET iceberg_secret;

statement ok
DROP SECRET storage_secret;
